,host_id,host_name,host_about,num_host_listings
4554,396784850,Grand Welcome,"Grand Welcome has perfected the art of short-term vacation rentals. As the leading property management franchise in the industry, we offer the most comprehensive, full-service program, providing both homeowners and guests with the care and attention they deserve. Each of our locations, from coast to coast, is locally owned and managed, but the company is nationally recognized with a team of experts based in our home office. This allows us to maintain a hands-on, boutique-style approach with premium marketing and guest service support.  

  
Planning your vacation begins with Grand Welcome. We offer an expansive list of high-end vacation rental properties ranging from mountain cabins, condos, and luxury homes. With thousands of properties to choose from, we are confident that the vacation home of your dreams is just a click away. ",97
1582,21265745,Brad And Sarah,"Husband and wife with two littles under the age of 8.  We love to travel, love the outdoors, and love to share other parts of the world and our country with our children.  

We both believe vacation and traveling is so important, and that carries over into how we take care of the people who book vacations with us!  ",94
4577,402998583,Jayden,"Aloha and welcome to Hawaii! My name is Jayden and I am thrilled to have you here on this truly magical island that I am humbled to call my home.

If you're looking for a unique Airbnb experience, you're in the right place. As the co-founder of VYBE Hawaii, my goal is to offer you an experience like no other. Each of the apartments I host are one-of-a-kind and have been stunningly renovated and beautifully designed with the modern-day traveler in mind. I believe that your home away from home should be comfortable and memorable, whether you're here for business or for a well-deserved vacation.

Our team at VYBE is committed to building long-lasting relationships with our guests and providing compassionate, genuine Hawaiian hospitality. I take pride in sharing my island and its culture with visitors from all over the world, and I welcome everyone with Aloha.

In addition to being an Airbnb host, I am also a licensed real estate agent. If you're considering investing in real estate in Hawaii, feel free to ask me any questions. I am passionate about helping people find their dream home in paradise.
I look forward to hosting you and showing you the beauty and aloha spirit of Hawaii!
",94
4534,389697794,David,"From the beaches to the mountains, and any cityscape in-between, my portfolio of resort style, fully stocked condo accommodations will provide you the ultimate vacation experience! 

",93
1554,20704144,William,"A Husband, Tennis coach and Entrepreneur that loves to travel!",93
3292,117224914,Castle Resorts And Hotels,"Vacationing in Maui doesn’t get better than Kamaole Sands, a condo resort built on 15 acres of gardens, waterfalls, and ponds. Live like you’ve always wanted to in an individually furnished condominium suite directly across from Kihei’s popular Kamaole Beach Park III. Defined by its laid-back vibe and tropical beauty, South Maui is a true Hawaiian paradise.

Our dreamy Kihei location near Wailea Resort and Makena Resort puts you in the midst of golf, spas and ocean recreation.

- Learn to surf at Kamaole Beach Park III
- Tee off at Maui Nui or Wailea golf clubs
- Stay on trend at The Shops at Wailea
- Snorkel amid the pristine waters of La Perouse Bay
- Indulge in spa treatments at Wailea Resort
- Sample craft brews at Maui Brewing Company

The best plan for your day is often no plan at all. Maybe you’ll start your morning with a swim in the Pacific or in our pool. You might mingle amid traveling kindred spirits at your resort’s Wednesday Mai Tai Party, and then grill a fresh catch with your new friends at the property’s public barbecue area. Or step out for a sunset dinner at one of Kihei’s fantastic cafes or bistros. Need to stay connected? We offer complimentary WiFi in the lobby, pool area, and all rooms.

Since 1993, Castle Resorts & Hotels has specialized in innovative hotel and resort management. We manage properties throughout the Hawaiian Islands, including Kauai, Oahu, Maui, Molokai, and Hawaii Island, as well as Auckland, New Zealand. Accommodations range from full-service hotels to resort condominiums and combines value, convenience, and authentic experiences.",91
3893,189583753,Mauna Kea,"Aloha & welcome to Mauna Kea Residences!  We offer luxurious two to seven-bedroom condos, townhomes, and estates set in the iconic Mauna Kea Resort. Many residences have a private pool, lanai space(s) for outdoor relaxation and panoramic ocean, golf course and mountain views. 

As well guests enjoy exclusive access to two pristine beaches, two award winning golf courses, many restaurants, and the Spa at Mauna Kea Resort. Come experience aloha!",88
754,5786717,Viktoria,"Aloha! I am a hospitality professional with a passion for customer service. My team consists of talented Guest Experience Specialists who care about your experience, and are available to assist you 24/7.   We offer travel insurance, discounts on rental cars, and professional, resort quality services to all of our guests; it would be our pleasure to host you for your next Maui vacation!
Maui Nō Ka ‘Oi, (Hawaiian for “Maui is the best"")",87
3583,147683024,AA Oceanfront,"AA Oceanfront Rentals and Sales specializes in offering professional and personal service to all of our guests and owners. We have the knowledge, experience and community connections to help make your vacation perfect! It is our goal to honestly and accurately represent our vacation rentals in Kihei and provide the best service possible to our guests. AA Oceanfront’s professional staff has a background in Resort Management, Customer Service, Marketing, and Real Estate – together we have the combined experience to make your vacation nothing short of amazing.",85
4774,457152913,Todd,"Highly experienced vacation specialist with an emphasis on vacation ownership properties.  Based out of our Myrtle Beach, SC office, let us help you put together your dream vacation.",85
4726,444732174,Sheryl,"Hello! I am a married Mom.  I have a seven-year-old boy and twin boys that are five.  My husband spent years in the travel industry.  Vacationing became a lot easier (especially with the kids) when staying at places that offer the in-room amenities of kitchens, washing machines, and separate rooms! I love sending travelers to beautiful locations across the country and offering them the easy, comfortable, and luxurious resorts that I have become accustomed to staying at.  Let me make your next vacation grand with ",84
4335,296130757,Jay,"Hi, my husband and I grew up and live in Los Angeles, CA. We have 1 son with autism. Our goal was always to introduce our son to new places and things to try and help him grow leaps and bounds. What we found was traveling was the most effective. So since then, we have immersed him into many different environments on our journey of growing as a whole family. We love helping others grow and enhance their love for life through travel. Please before booking confirm with us the dates you are looking to travel as the Airbnb calendar sometimes has issues updating itself.

Our Warmest Wishes, Happy Travels!
",82
3234,111817270,Ahmet,"I have access to many locations not listed here, so if you're looking - let me know where and I'm happy to check in to it for you.",79
1118,10548519,Vacasa Hawaii,"Vacasa
Vacation Home Management

Vacasa unlocks the possibilities of how we enjoy vacation homes. We take care of managing our homeowners’ vacation houses so they can have peace of mind (and their home when they want to). And our guests book vacations confidently knowing they’re going to find exactly what they’re looking for without any surprises.

Each vacation home is always cared for by our professional local teams who implement our high cleanliness and maintenance values, while the hands-off tasks of vacation rental management--marketing, filing taxes, and maintaining a website--are handled by a specialized central support team. Our passion and focus remain true: to empower our homeowners, guests, and employees to invest in vacation.",78
3308,118578746,Chase 'N Rainbows," Chase ‘N Rainbows (CNR) Real Estate, Inc. is a Maui-based company with two divisions: vacation rental management and real estate sales. For the past twenty years, CNR has been offering visitors and Kama’aina alike, affordable and luxury accommodations at a very competitive price. All of its vacation rental units are carefully selected, meticulously inspected, attractively furnished and well maintained to the highest standards. CNR is committed to providing the finest product and unsurpassed personalized service in the industry. These condominiums come highly recommended by leisure, business, and family travelers with distinctive tastes. A significant number of satisfied, return guests speak for the company’s service commitment and quality product. Chase ‘N Rainbows is a proud member of the Hawaii Visitors & Convention Bureau (HVCB), The American Society of Travel Agents (ASTA), Maui Visitors Bureau (MVB), Hawaii Association of Realtors, Maui Chamber of Commerce, and Vacation Rental Managers Association (VRMA).

*Please note we are a licensed and bonded professional management company and we DO NOT advertise on Craigs List 

Follow this link to view all listings we manage on West Maui:
https://www.airbnb.com/users/118578746/listings",75
2217,43068394,Vacation-Maui,"Vacation-Maui is a top-rated vacation rental agency, representing clean, well-equipped beach condos in the sunny resort area of Kihei, Wailea, and Makena. With hundreds of online reviews, our focus is on the best possible guest experience. 

Our office is within a few minutes of all of our properties, and we respond immediately to guest issues. We’re partnered with the largest Real Estate brokerage in the country, Keller Williams; we advise on and sell Maui investment condos, based on the best possible ROI. ",71
175,756093,Kaua’i,"Locally owned and operated, Kauai Exclusive Management has been in business since 2008. Our collection of luxury homes and condos stretches from Princeville to Poipu! With a dedicated full time Airbnb team, we strive to host our Kauai Exclusive guests with professionalism and aloha. We are always available at 877GOKAUAI and happy to help however we can. We look forward to hosting you!",71
2430,52042236,Destination Maui,"Choose from over 100 of the best island condos locally managed by Destination Maui Vacations located in Kihei, Maui~Hawaii.
Let us help you find the perfect spot for your dream vacation!",71
1827,28017763,Steve,Aloha!   We are a family owned and operated vacation rental and management company.   Maui Sunset is an oceanfront condominium resort complex located in sunny Kihei on the island of Maui.    Please reach out if you have any questions or need help finding the best condo for your trip.,70
2780,71362662,Vacasa Hawaii,"Vacasa
Vacation Home Management

Vacasa unlocks the possibilities of how we enjoy vacation homes. We take care of managing our homeowners’ vacation houses so they can have peace of mind (and their home when they want to). And our guests book vacations confidently knowing they’re going to find exactly what they’re looking for without any surprises.

Each vacation home is always cared for by our professional local teams who implement our high cleanliness and maintenance values, while the hands-off tasks of vacation rental management--marketing, filing taxes, and maintaining a website--are handled by a specialized central support team. Our passion and focus remain true: to empower our homeowners, guests, and employees to invest in vacation.",70
4778,458926111,Desiree,"“Vacation.OnPoints” 
Timeshare Property Manager, I help people rent their properties and manage their timeshare by connecting guests with properties all over the world.",70
3093,98570220,Kanani,Garden Island Properties LLC is a family owned and operated vacation rental and real estate company located on the island of Kaua’i.  We have been in business for over 30 years and continue to service our owners and guests with the Aloha Spirit.  We look forward to hosting you on our beautiful island of Kaua’i! To view all of our Kaua’i vacation rentals please visit https://www.airbnb.com/users/98570220/listings.,69
2550,57940735,Pmi,"Book with confidence with PMI Maui, a local Real Estate Brokerage that specializes in vacation rentals. We are located within a mile of the resort and available 24/7. This condo offers an upgraded vacation experience and is fully equipped with everything that you need to have a great vacation. ",69
4425,340080088,Bianka,An eternal traveler.,68
2325,47208806,Oceanfront Realty International,"We are a professional property management company located in Princeville, on Kauai's north shore.  We have been specializing in vacation rentals on Kauai for 30+ years.  Our offices are open 7 days a week, and we have an after-hours emergency number should you need to reach us for any reason.  We pride ourselves on being prompt, friendly, and professional, and providing excellent customer service to all our guests.  We look forward to hosting you on Kauai.  ",64
3275,115700802,Princeville Vacation Rentals,"Princeville Vacation Rentals and Kauai Real Estate Group prides itself in providing our guests' locations to make amazing memories while visiting our garden isle of Kauai.  If you have any questions, don't hesitate to reach out and let us know.  We hope you fall in love with our little piece of paradise as much as we have.",63
3637,153535761,Hale Kamaole,"The complex is located directly across from Kamaole III State Beach Park, which is known as one of the most beautiful and safest beaches in the Islands.  It is perfect for swimming, snorkeling, sunning, jogging, picnicking, kite flying, and especially enjoying amazing sunsets and whale watching.

Each unit has a private lanai that faces the interior of the complex, offering views of the expansive lawns, pools, and lush tropical landscape of palm trees, hibiscus, birds of paradise and plumeria trees.  Most lanais also offer views of the beautiful Pacific Ocean and spectacular sunsets.  

There are two pools, a covered pavilion, and a full size tennis court on the property.  Every evening the outdoor barbecue area is a popular spot to socialize while grilling the perfect dinner and watching as the Hale Kamaole conch shell band performs their nightly sunset ritual.

You will find world class golf courses, fantastic snorkeling and diving, many Maui activities, abundant shopping and delicious fine and family dining all within minutes of Hale Kamaole.",60
3280,116465695,Castle Resorts And Hotels,"This exquisite condominium is located on Waikiki Beach just next door to Fort DeRussy Park and one block from bustling Kalakaua Avenue. Each studio, one- and two- bedroom suite features kitchenette or full kitchen, and in-room washer/dryer.


Since 1993, Castle Resorts & Hotels has specialized in innovative hotel and resort management. We manage properties throughout the Hawaiian Islands, including Kauai, Oahu, Maui, Molokai, and Hawaii Island, as well as Auckland, New Zealand. Accommodations range from full-service hotels to resort condominiums and combines value, convenience, and authentic experiences.",59
3874,186952542,Love Rentals,"Hi there,

Welcome to the Airbnb page for Love Rentals - Find Your Bliss. Our rockstar team works on behalf of industry-leading professionals and homeowners. People use our software platform to help them find potential guests such as yourself. We love connecting guests with the perfect Airbnb. We work every day to make this next vacation, the best vacation. 

Please do not hesitate to reach out to us to lend a hand and thank you in advance for being our best guest yet! 

Your Love Rentals Team",55
4142,243470944,Resort Stay,"We specialize in Wyndham Vacation Resort Rentals.  Our company, Resort Stay, is a licensed travel agency and we've been in business since 2012.   You can count on us to provide you with an amazing Resort Stay!

",53
3665,156373103,Daniel,A licensed professional real estate manager.,52
3571,146182295,Sullivan Properties,"Aloha & Welcome to Maui Resorts at Sullivan Properties, offering affordable Vacation Condo Rentals on the tropical paradise island getaway of West Maui, Hawaii. We have been providing visitors & residents with the best Maui Condo Rentals & Property Management Services for over 40 yrs. We offer the best quality, selection and service on the ""West Side"" of Maui: Lahaina to Kapalua.

Sullivan Properties Inc.",52
3492,136437655,ITrip Maui,"iTrip Vacations - Maui offers many Maui home rentals, all beautifully situated on the sparkling beaches of Kaanapali, Napili, Kapalua, Lahaina, Kihei, Wailea and Maalaea. Our Maui home rentals are beachfront style, offering activities like snorkeling, surfing, whale watching, hiking, and relaxing by the beach or pool. Not far from many of our Maui home rentals is Haleakalā National Park, an amazing destination for beautiful views, complete with a visitor center for educational information. Also near all of our Maui home rentals are a number of great shops and delicious restaurants for refueling after a long day at the beach. All of our Maui home rentals offer you all the comforts of home with the addition of luxurious amenities. Book one of iTrip Vacations' many beautiful Maui home rentals today for the trip of a lifetime!",51
2291,46013796,Maui Westside,"Live 'The Good Life' on Maui with Maui Westside! Our family-owned business is dedicated to making your island getaway unforgettable. With local expertise, friendly staff, & free concierge services, we're here to ensure you have a great stay. We are a fully licensed & legal property management & real estate brokerage firm - license #RB-21121. Please feel free to contact us via email, text, or call during your stay.",50
4803,468881737,Evan,"Hello, I am Evan! 
Growing up I always went to amazing timeshare resorts that always made it feel like home. Vacationing has always been apart of who I am and I’d love to send you on your next vacation to somewhere special! During my studies, I decided to make an account, so I could help send you on a memorable getaway. Please let me know how I can make your vacation grand!",49
2047,36133410,Patty,"Travel aficionado. Enjoy meeting people, eating local foods and nature.",49
3920,195864879,Leslie At Luana Kai Resort,"Mario and I run the front office of Luana Kai and handle all reservations in the rental pool. You can reserve your Maui condos in the sun with our Kihei vacation rentals. On the ocean and near to Maui's best beaches, golf, and everything else. Your home away from home. With a large pool, sauna, whirlpool, barbecues, tennis, and more.",48
4105,234194182,Chris,"I’m a full time dad of 2 with a passion for travel! I just want to share my knowledge of amazing vacations with you so you can have an amazing trip!

We are a Timeshare Rental Brokerage. We have access to hundreds of amazing resorts for hotel prices all of the country. 


Thanks!",48
2002,34024330,Alohana Realty LLC,"We are a full service boutique Real Estate firm, specializing in Vacation Rentals and Property Management.
",48
3195,107979946,Castle Resorts And Hotels,"Kauai’s Plantation-style Resort on Famous Poipu Beach

Get ready to be charmed by the feel of old Hawaii at Kiahuna Plantation & The Beach Bungalows, a Poipu resort set upon 35 gorgeous acres of landscaped lawns, gardens, and one of the best beaches on an island famous for its beaches. Our condo resort has all the amenities you’re looking for in a home away from home on Kauai’s sunny south side.

Since 1993, Castle Resorts & Hotels has specialized in innovative hotel and resort management. We manage properties throughout the Hawaiian Islands, including Kauai, Oahu, Maui, Molokai, and Hawaii Island, as well as Auckland, New Zealand. Accommodations range from full-service hotels to resort condominiums and combine value, convenience, and authentic experiences.",48
1828,28035243,Jeff & Shana,"Aloha...! 

We have a lot of Gratitude for living on the beautiful island of Kaua'i. 

We Embrace the Diversity of our Global Community. We warmly welcome travelers from all parts of the world and all walks of life. Our goal is for your stay to be Most Enjoyable!  

We welcome your questions and would be Delighted to Host Your Stay.  

With gratitude, 
Shana & Jeff",47
168,733802,Kathy,"To view all of my listings, click here:  https://airbnb.com/users/733802/listings

I am the owner of Maui Vision Properties LLC dba Maui Vision Rentals and Kauai Vision Rentals. Maui Vision Properties LLC became a reality and a business starting with my personal condo at the Kihei Akahi Resort C618.

Maui Vision is a business I love because I get to share the Aloha Spirit, the beauty of the land, and talk story with people from around the world. It is nice to know that we can contribute to someone’s Hawaiian vacation experience in a positive way. We love to hear back from our happy guests.

I used to live on the island of Oahu with my US Navy family when I was young.  We later moved to Southern California.  I knew one day I would return to Hawaii, the place I fell in love with long ago. I took a leap of faith and purchased my Maui condo June 2002 this was the beginning of fulfilling her prophecy to once again return to Hawaii soil.

I am a tropical expression artist who paints on canvas and etched metal.  My work is inspired by the beauty of the islands and has been displayed in several Maui art galleries over the years.  I am a writer and have my first book on Amazon.  I recently took up hula dancing and love to immerse myself in the culture and grace of this island.

I have over 25 years of business administration and customer service experience working for large corporations and high tech startups.

If you are in need of a caring Realtor here on Maui, please contact Kathy McCartney RB#23100 and Maui Vision Properties RB#23099.",46
3922,196635279,Koko Resorts,"Welcome to Koko Resorts, where we invite you to join our Ohana for a memorable Hawaiian stay. Our clean, affordable suites come in various sizes and prime locations. Our friendly team is dedicated to providing top-notch service and assistance for your comfort. Should you have any special needs or concerns, we're always ready to help. Thank you for choosing us for your Hawaiian escape.",46
2274,45475738,Terry,"Aloha! We are a local family hosting legally-zoned vacation rentals in Waikiki. We love hosting, meeting new people, and offering a great experience on this beautiful island we call home! ",45
1918,31214940,Scott,I am a certified travel agent for the past 10 years. I am married with 5 kids and a huge dog! I am a family man who loves to spend time with the family. I enjoy traveling and enjoy helping others travel even more!,45
1907,30787515,Brooke,"Worked for the last 16 years matching vacations with those that love to vacation.  I specialize in budget vacations with high quality properties.  I enjoy movies, swimming and dining.  I have 2 grown kids and I love bulldogs.",44
2203,42705922,Lei Hawaii,"Hello,

We are Lei Hawaii Realty Inc.  Our office locates in the center of Waikiki where thousands of tourists visit!!

We start managing Airbnb units, so you are welcome to stay in our Airbnb units!! We provide almost all inventories to live comfortably for a long term like small staff like iron. And rate is so low. We want you to repeat staying Hawaii every year in our units!! See you soon.

Check all the listings from here.　And also search the date and fees!!
https://www.airbnb.jp/users/42705922/listings


Please search our website by the key word, Lei Hawaii. 

ハワイで不動産売買・賃貸・管理を行っていますレイハワイ不動産です！　オフィスはワイキキの中心(H&Mのビルの7階)にございます。ハワイに長く、快適にお安く滞在して頂けるお部屋の提供を開始致しました。問い合わせなどには誠実に対応させて頂きます。全従業員・エージェント、皆でお待ちしております！

全てのエアビーリスティングはこちらから。空室や費用も確認出来ます！
https://www.airbnb.jp/users/42705922/listings


HP検索は　【レイハワイ】",44
4917,512809339,Maui Rental,"Maui Rental Group is the premier property management company servicing vacation rentals in Lahaina, Kihei, Wailea and Kapalua. As a member of the VTrips family of vacation rental brands, Maui Rental Group offers our guests the peace of mind knowing we are available 24 hours a day to ensure their vacation is a success. We take your vacation seriously and will do anything we can to make sure you leave your worries at home and hope to see you soon!",43
