,host_id,host_name,host_about,num_host_listings
3652,154324699,Vacasa Hawaii,"Vacasa
Vacation Home Management

Vacasa unlocks the possibilities of how we enjoy vacation homes. We take care of managing our homeowners’ vacation houses so they can have peace of mind (and their home when they want to). And our guests book vacations confidently knowing they’re going to find exactly what they’re looking for without any surprises.

Each vacation home is always cared for by our professional local teams who implement our high cleanliness and maintenance values, while the hands-off tasks of vacation rental management--marketing, filing taxes, and maintaining a website--are handled by a specialized central support team. Our passion and focus remain true: to empower our homeowners, guests, and employees to invest in vacation.",43
3820,177215589,Quam,"Aloha, 

Quam Properties Hawaii, Inc. is conveniently located in West Maui at Napili Plaza Shopping Center. We provide a variety of services to West Maui and the neighbor islands. We are a family owned and operated management company with over 30 years experience in Hawaii. We have a full service, dedicated, friendly staff, and attention to details are our primary concern. 

Our services include Luxury Vacation Rentals and Concierge Service, Property Management, Association and Project Management, Long Term Rentals, and Real Estate Sales. Our office is open Monday through Friday from 8:00 AM to 5:00 PM and Saturday from 8:00 AM to 4:00 PM Hawaiian time. 

Quam Properties Hawaii requires a 50% credit card deposit.  We accept Visa, MasterCard and/or Discover. You may cancel outside the 60 days prior to your arrival for a refund of your deposit minus a $100 cancellation fee.	

Mahalo, Quam Properties Hawaii!",43
4255,266083019,Extra Holidays®,"Stretch out and relax in spacious resort suites while experiencing all the comforts of home. Most suites are equipped with a full kitchen, washer/dryer, private bedrooms, separate living/dining areas and unbeatable resort amenities for everyone. Extra Holidays® is the official resort condo rental source for Club Wyndham®, WorldMark by Wyndham®, Shell Vacations Club® and Margaritaville Vacation Club® by Wyndham.  ",42
1456,17918208,Keri,"Keri here! Enjoy all the bells and whistles in my portfolio of luxury condos. Stocked to the gills, and all amenities included, you and your family will be sure to enjoy your vacation!",42
4500,376749050,Casago Kona,"We are a professional Vacation Rental Management Company and we have the great fortune of managing over 70 beautiful rentals in Kona.  Most are one bedroom condos right on the ocean, but we also have some 2 and 3 bedroom condos and beautiful homes with pools as well.  We work hard to ensure you have an excellent experience with us :)  Aloha",41
2781,71367417,Koloa Kai,"Hi, we are Koloa Kai Vacation Rentals.  

Whether you are in need of trustworthy hands to manage your rental property, are looking for a fabulous residence to call home base on vacation, or anything in between, we would love the opportunity to work with you.  

For as long as we can remember, we have wanted to find a way to share our love of Kauai with our friends, colleagues, and family.  Finally, one day, under a crimson-streaked Poipu sunset, we realized that, with a license to practice law in Hawaii and a wealth of property management experience on the mainland, nothing was holding us back from attaining our dream but ourselves. 

Hence (and admittedly with a lot of hard work along the way), a rental property business was born.  With this spirit, we developed our motto: ""live your aloha.""  Live your passion.  

We're here to serve you.  Call us with your property needs. ",41
2012,34386367,Kauai Calls!,"I have always known I would have a home on beautiful Kauai and dreamed of hosting guests who come to Kauai to fulfill their own life's dream. My favorite TV show when growing up was 'Fantasy Island' and here I am. Over the past 13 years I have come to realize that all that guests who have stayed at Wailua Riverside Hideaway become ohana the moment they arrive. It is you the guests who are the true stars in this Fantasy Island called Kauai! 

I now run a vacation rental business here on the island: Kauai Calls! managing over 40 properties with co-hosting help from Cathy and Michelle, my ohana! 

I look forward to greeting/meeting you here at the Wailua Riverside Hideaway! We have self-check-in set up for all other properties on the island!  

Mahalo nui loa! 
Candace, 
Owner P RB
Kauai Calls!",41
1925,31297800,Parrish Maui,"Hawaii-based and locally operated out of Kapalua Resort, The Parrish Collection Maui is a full-service vacation rental management company proudly overseeing 50 privately owned homes in the Bay Villas, Golf Villas and The Ridge Villas.  

Originally formed in 2007, Aloha Vacation Villas is now part of The Parrish Collection group of companies.  Based on Kauai, The Parrish Collection LLC manages over 350 properties on both Maui and Kauai.

JP Parrish is the Owner and Principal Broker of The Parrish Collection LLC, originally formed in 1984 that is now the largest independently owned vacation rental company on Kauai.  

Headquartered at Poipu Beach, Kauai and operating owner and guest services’ desks at three major Kauai resorts, The Parrish Collection LLC offers easy access to owners and guests. 

Its dedicated team has worked together for many years and offers an unequaled commitment to personal and professional service, attention to detail, and the highest quality standards all balanced with a true sense of Aloha.",40
1748,25700238,Anke,"Aloha, I'm Anke, property manager surfer, runner and kiteboarder living on Maui. Managing vacation rentals in Maui and I love what I do! 

Love, Live Aloha!",39
2271,45388803,Nobu,"My name is Nobu, and I am exited to welcome you to the island of Oahu.
If you're looking for an economy rental, or even a high end luxury rental we have it all.  Our goal is to offer you a beautiful experience during your stay on the islands.  Visiting for work, or vacation we have something that'll works for you.
Me and my team are also licensed real estate agents. If you're considering investing in real estate in Hawaii, we would love to help.",39
3132,101995602,I Go Maui Vacation Rentals,"I Go Maui Vacation Rentals offers you the “The Best Of The Best”  in affordable first class, ocean front and beach front luxury and deluxe accommodations along with hospitality service that over flows with the spirit of Aloha! A unique vacation rental specialist emphasizing hands-on, detailed, and attentive customer service and condo care.",39
1775,26591491,Rick,"Hawaii Ocean Club Realty Group is an up-and-coming company in the sales and property management market with emphasis on short-term vacation rentals. We are an ambitious team looking to build trust and long-term relationships with our guests.  Whether you are someone inquiring about a dream vacation, looking for trusty well-versed locals to manage your properties, needing someone to help sell your home and/or looking to buy your dream home here in Hawaii, we're here to help with aloha spirit! We currently manage and care for many beautiful rooms across Waikiki to Ko'olina.",38
2752,69710602,Premier Kauai Ohana,"Premier Kauai Vacation Rentals is owned by Cindy Plemer. Cindy is Hawaii-born and raised, waking up every day to the privilege of calling one of the most beautiful places in the world home: the Garden Isle of Kauai.

My passion has been connecting the land I love to guests, owners, sellers, renters and visitors throughout the world, turning dreams of Kauai into an attainable, magical reality.

By living the spirit of aloha, creating moments of a lifetime on Kauai for those around me, deep knowledge of the Kauai market, and real estate sales expertise, I have been successful in many areas of real estate. Beginning as a Resort General Manager for some of the world's largest hoteliers to property management experience and real estate sales, I've been entrusted to care for assets exceeding well over $50,000,000.

Whatever the occasion, if we may be of assistance, we are happy to be of service to you here on Kauai.",38
3710,162428194,Raven,"I love to travel and meet people from all around the world. I travel a lot for business using airbnb and love being an airbnb host. 

I am originally from Canada but now call paradise home. I coach new and existing vacation rental owners how to create a successful BADA$$ airbnb! I specialize in interior design and property management. For free airbnb tips & tricks find me on IG @itsravenstarr",38
3266,114271211,Castle Resorts And Hotels,"Kanaloa at Kona by Castle welcomes the hopeless romantics, the thrill-seekers, and those who just want to have fun. Our resort feels secluded, but is close to charming shops, restaurants, and sits upon the dramatic lava rock coast. You’ll enjoy year-round sailing, snorkeling, and fishing, dine among spectacular Kona sunsets, and fall asleep to the sound of crashing waves.

Since 1993, Castle Resorts & Hotels has specialized in innovative hotel and resort management. We manage properties throughout the Hawaiian Islands, including Kauai, Oahu, Maui, Molokai, and Hawaii Island, as well as Auckland, New Zealand. Accommodations range from full-service hotels to resort condominiums and combines value, convenience, and authentic experiences. ",37
4453,352781868,Jessica,Jessica owns and operates Salt Water Hawai'i that manages legal vacation rentals on Hawai'i Island with a dedicated staff with over 50 years combined experience.  Let The Salt Water Crew treat you as 'Ohana (family)!  E Komo Mai (Welcome)!,37
3570,146035240,Private Homes Hawaii,"We are a licensed, professional property management company operating vacation rentals on Oahu and the Big Island. Our team will meet guests on arrival, provide an orientation to the property, and be available for assistance throughout the stay, if needed.  

We pride ourselves on providing a consistent, high-quality experience no matter which home you choose.  Homes are incredibly well stocked from kitchen items to bath amenities to beach necessities.  Just bring your luggage!  

Many of our listings are at the Four Seasons Hualalai Resort where I worked for 10 years as VP of Marketing.  The Resort continues to be the #1 rated property in Hawaii and is my family's favorite place to visit.  My business partner now runs our Big Island operation while I have relocated to Kailua, Oahu.... another amazing beach destination!  Fabulous restaurants, great beaches, and charming beach- town shops characterize Kailua and we have a great selection of vacation homes in the area.  
We look forward to having you with us!",37
4468,363193988,Castle Resorts And Hotels,"Bamboo Waikiki Hotel features a selection of moderately priced guest rooms, studios, and suites in a “tropical-urban Zen” atmosphere that makes you feel relaxed and refreshed. All accommodations offer a private lanai, WiFi access, air conditioning, flat screen LCD TV, iDock, laptop-compatible safe. While all rooms include at least a microwave, coffee maker, and mini-refrigerator, select rooms include a kitchenette or full kitchen.

You’ll love Bamboo Waikiki Hotel’s easy access to the golden sands of Waikiki Beach and the International Market Place. Embrace the action that makes Waikiki the world’s most famous urban resort. Then retreat to your tranquil oasis away to unplug and revive.

Since 1993, Castle Resorts & Hotels has specialized in innovative hotel and resort management. We manage properties throughout the Hawaiian Islands, including Kauai, Oahu, Maui, Molokai, and Hawaii Island, as well as Auckland, New Zealand. Accommodations range from full-service hotels to resort condominiums and combines value, convenience, and authentic experiences.",37
3605,149880750,Pacific Hale,"We LOVE hosting guests from all over the world. We are Marcela Gama and Florencia Arias, licensed real estate agents on Oahu. We have been sharing ALOHA with our Airbnb guests since 2016.
We hope you book your stay with us. MAHALO.

REMAX Honolulu RB-20389 
Marcela Gama Filho  RS-61498
M. Florencia Arias RS-79988",37
3402,128058869,Tina,"I live and work on Kaua’i. I Love this Hawaiian Paradise, and Love sharing it with Others. ",36
3801,174792040,RoomPicks By Victoria,"Going someplace new is always exciting. And what would that adventure be without a great place to lay your head at the end of the day? That is where I come in!

As an avid traveler myself, I know how the little things can set the pace for a new experience! You want something hospitable and inviting to give you a remarkable experience that no one else can give you. A heated pool, or jacuzzi at the end of the day to relax in, or a nice meal within walking distance? Down to beds that cozy and homily. Sounds good? Well, you have come to the right place.

We offer handpicked accommodations in remarkable properties for a  top-notch experience with a few added extras. As well as tips, recommendations, and 24/7 customer support to make sure that your experience is the best it can be! ",35
3125,101426056,Private Paradise Villas,"We've been exceeding our guests' expectations since 1995 with our premium beachfront estates, award-winning resort villas, romantic hideaways and secluded retreats on Maui. Our luxury homes and villas are “Your Own Private Paradise” for your visit to Hawaii. 

Our highly attentive staff includes a personal on-island concierge, property manager and greeter who are at your service, free of charge, from initial planning stages through completion of your stay.

Over the past decade, Conde Nast Traveler and Travel+Leisure magazines have recognized our owner, Irene Ann Aroner, as a premier Hawaii villa rental specialist and our company, Private Paradise Villas (formerly Tropical Villa Vacations), as a premier Hawaii villa rental agency.",35
4584,406956614,Stay Aloha,"Aloha, here @ Stay Aloha we manage beautiful Hawaii properties with exceptional service & guest experience. Our condos are very well appointed & thoughtful with your memories in mind. Every unit is photo’d & inspected before your check in, luxury bath products, essentials, welcome gift, & little resort touches throughout every unit. Wifi QR codes, towels made into artwork, welcome guides & more. Don’t take our word for it, see our raving reviews.",35
4268,269562627,Makana Kauai Properties,"Kaua'i is truly paradise, and the Spirit of Aloha is in everything we do!

The beauty and culture of Kaua'i inspires first class vacations and we are your local, on-island team of vacation rental professionals excited to share the gift of Kaua'i with you.  Through our beautiful vacation rental homes and personal knowledge of the island and culture, you can trust us to make your vacation a paradise.

Our heart is Kaua'i and we are Aloha.",35
3285,116782456,Castle Resorts And Hotels,"Since 1993, Castle Resorts & Hotels has specialized in innovative hotel and resort management. We manage properties throughout the Hawaiian Islands, including Kauai, Oahu, Maui, Molokai, and Hawaii Island, as well as Auckland, New Zealand. Accommodations range from full-service hotels to resort condominiums and combines value, convenience, and authentic experiences.",35
4954,522727606,Joseph,I’m a frequent traveler for both business and leisure and love getting to play even the smallest role in creating vacation memories for everyone I can!,35
1986,33518620,Grace,Professional short term rental management company in Hawaii. We manage over 20 properties.,34
3302,117881929,Talia,"Hi! Love to travel, always looking for my next adventure!",34
4010,215548272,Tom,Tom lewis,33
4864,489363368,Vacation Award,"Hi, my name is Nick. I love traveling and helping others! My company helps nonprofits raise money by renting out timeshares I've bought over the years. I'm glad I can rent them out on Airbnb and save you money, while also helping out others in need! I make sure all of my prices on Airbnb are significantly lower than the resorts themselves. All profits made are donated to various charity organizations. Thank you so much for supporting my mission!",33
3344,121746309,Castle Resorts And Hotels,"Tempting at every turn, Halii Kai at Waikoloa Resort welcomes you to discover the beauty and bliss of the Big Island’s sunny Kohala Coast within the world-famous Waikoloa Resort. You’ll love the easy lifestyle in this exclusive resort community where the best days are spent doing nothing at all.

Our beautiful coastal location between Kailua-Kona and Waimea’s upcountry puts you in the heart of Hawaii Island’s exciting recreation. Whether you’re into golf and spas or sport fishing and sailing, you’ll find your passions fulfilled.

 - Tee off on Waikoloa’s King’s and Beach courses with special guest rate
 - Catch a morning snorkeling excursion from Kawaihae Harbor
 - Explore ancient rock art in the Anaehoomalu Petroglyph Field
 - Catch monthly “Movies Under The Stars” at Queens’ MarketPlace
 - Melt into a Hawaiian lomilomi massage in an ocean side cabana
 - Horseback ride through the pastures of Kahua Ranch

Halii Kai’s spacious two, and three bedroom vacation villas and town homes are thoughtfully designed so families and friends have the perfect mix of privacy and open living spaces.

 - Privacy for parents and children 
 - Separate rooms create private space to spread out and relax.
 - Fully equipped kitchens 
 - Access to a kitchen reduces stress, saves time and cuts costs.
 - In-room washers and dryers 
 - Save time, pack less, save on baggage fees and stay fresh.
 - All the comforts of home 
 - But with daily housekeeping and amazing views.

Castle Resorts & Hotels was founded in 1993 and is a wholly owned subsidiary of The Castle Group, Inc. Headquartered in Honolulu, Castle manages a broad portfolio of guest accommodations including value/economy hotels, full-service hotels and spacious all-suite condominium resorts and luxury villas in the Hawaiian Islands on Oahu, Maui, Molokai, Kauai and Hawaii, and in New Zealand on the North Shore of Auckland. 
",33
4705,439429870,Luxury,We are a family owned property management business that love to travel!,32
3404,128175133,Seaview,"Hi,
Seaview Property Group provides self checkin and check out clean and efficient rooms. We are very patient, super positive hosts who looks forward to assisting new guests and returning guest. So, dont hesitate and reserve a room with us. Very close to UH Manoa and Manoa valley. Relaxing and cozy setting..",32
2200,42618840,Vacasa Kauai,"Vacasa
Vacation Home Management

Vacasa unlocks the possibilities of how we enjoy vacation homes. We take care of managing our homeowners’ vacation houses so they can have peace of mind (and their home when they want to). And our guests book vacations confidently knowing they’re going to find exactly what they’re looking for without any surprises.

Each vacation home is always cared for by our professional local teams who implement our high cleanliness and maintenance values, while the hands-off tasks of vacation rental management--marketing, filing taxes, and maintaining a website--are handled by a specialized central support team. Our passion and focus remain true: to empower our homeowners, guests, and employees to invest in vacation.",32
2851,77524831,David,"Stay in luxury @ Hilton, Hyatt, Marriott, Ritz-Carlton, Westin & Ski Vacation Club Timeshare Resorts that have all the privacy, luxuries & amenities of a high-end hotel & resort brand with benefits of more space & features such as furnished kitchens & washer/dryers compared to a hotel room (check details for each of my listings to confirm amenities & benefits which vary). Check out all Airbnb listings:  https://airbnb.com/p/zipscape",31
1201,12057949,Holly,My husband and I have been blessed with the opportunity to make our DREAMS our MEMORIES and we're here to help assist you with yours'..........Traveling is TRULY what life is about! ,31
3986,210430041,Alyssa,"Born and raised in Alaska, now living the dream in Hawaii

Realtor Associate and Property Manager at Tropical Escapes Realty

RA 81130",31
4432,341809814,Vip,Aloha Guests! We would love to share a bit about who we are and what we do.  Valley Isle Property Management is a vacation rental management team made up of licensed professional property managers. We specialize in personalized vacation rental property management in the South Maui area (Kihei & Wailea). We love Maui and we look forward to hosting you and sharing a piece of paradise with you during your stay!,31
3340,121679638,Evolve,"Hi! We’re Evolve, the hospitality team that helps you rest easy when you rent a private, professionally cleaned home from us.

We promise your rental will be clean, safe, and true to what you saw on Airbnb or we'll make it right. Check-ins are always smooth, and we're here 24/7 to answer any questions or help you find the perfect property.",31
396,2349948,Hawaii Dream Realty TEAM,"ALOHA and WELCOME!  We are a TEAM of professionals who manage individually owned condo apartments in Waikiki. Our units are well maintained, repaired when necessary and treated for pest prevention. We try not to interrupt our guests, but if the unexpected happens, we do our best to resolve it quickly with the least inconvenience. We look forward to hosting you! 
Aloha & Mahalo, Hawaii Dream Realty LLC RB-19373, 2450 Koa Ave, Honolulu, HI 96815",31
1245,13039811,Stay Maui LLC,"Since 1984, Kumulani Vacations has specialized in South Maui Vacation Rentals and Real Estate Sales.

Our office is centrally located in Kihei and we are a hands on management company, available 24/7 to assist you in making your dream vacation a reality. We are professional, knowledgeable and will go the extra mile sharing the “aloha” spirit.

We offer fully furnished condos priced from affordable to luxury. The staff at Kumulani goes above and beyond to help you choose the location and atmosphere that will fit your lifestyle and requirements for a perfect Maui holiday.

All of our condos have a fully stocked kitchen, complimentary wifi, and all the comforts to make your Maui vacation fabulous!",31
4114,236664052,Chimera,"Thank you for visiting Chimera Vacations. We look forward to welcoming you!

We offer luxury vacation rentals all across the world at competitive rates!

We have accommodations across the United States including Hawaii, 
Mexico, Canada, the Caribbean (St. John, St. Thomas, Aruba, Bahamas, St. Kitts), Malaga-Spain, Phuket-Thailand - and several other locations. 
*Please request for additional listings that may not be posted 

Feel free to request a customized rate for your specific desired dates. We will work with you to offer the best available stay.

We may have Special Last-Minute Stays or Early-Bird Offers for your requested stay.

Thank you,
Chimera Vacations

Owner Owned & Professionally Managed Villas to ensure an enjoyable and smooth stay! Feel free to reach out to Chimera Vacations' Personal Concierge for exclusive offers!

**Providing Luxury Getaways | To help Luxury Accommodations be more Globally Accessible for all People to Enjoy and Explore the World**
",30
4236,262533942,Sharon,"Hawaii vacation host since 2010 Oahu, Kauai, Big Island, Maui
Airbnb host since May 2019.",30
3204,108986794,Maui Kaanapali Vacation Rentals,"Raising the Standards at the Maui Eldorado for Over 20 Years

We're world travelers who first visited Maui over 20 years ago and have been in love with this special island ever since. As hospitality specialists, we have international experience at top hotels and restaurants in Asia. Beginning as condo owners at the Maui Eldorado, we were the first company to raise the standards, invest in quality, and begin upgrading condos. Since then, we’ve grown naturally to suit the needs of our owners and our guests. 

Pride in Everything We Do

From our background in food services, where we’ve won numerous awards, we know how to take care of our guests. We take pride in everything we do. Kaanapali Beach, and the west side of Maui, holds a special place in our hearts and we look forward to sharing our passion with you. 

Personal Guest Service - From Beginning to End
Based on-island, right in West Maui, we offer complete customer service throughout your Hawaiian vacation. From the moment you begin planning your trip to the time you leave, we’re here to help. We’ll be sure you find the perfect condo for your group and connect you with Maui’s top activities and attractions. 

Offering  privately-owned studios,  1 and 2 bedrooms at the Maui Eldorado Resort located on Kaanapali beach surrounded by Kaanapali golf course. Exclusive beachfront clubhouse with full kitchen on the beach!

As a host, customer satisfaction is our #1 priority, as we know you have choices. Let us help make MAUI memories last!!",30
2398,50482854,Marisa,"Aloha everyone! Here’s a little about me. I am a Business owner, Real estate agent and property manager here in Hawaii. I grew up in Coeur d’Alene Idaho and moved to the heart of Kailua Kona 22 years ago and fell in love with paradise! I enjoy the beaches, snorkeling, and exploring what this island has to offer.",30
3600,149306068,Crystal,We help homeowners process their bookings in a timely manner. There are several agents who will be able to assist you. Please understand most of the time we depend on the owners approval and calendar availability in order to approve your stay. We will always do our best to assist you and make your vacation an enjoyable one. Thank you for considering booking with us.			,30
