,host_id,host_name,host_about,num_host_listings
2132,39073224,Maui Resort Rentals,"The Ohana (Family) at Maui Resort Rentals has been helping vacationers ""Make Maui Reality"" for over 50 cumulative years on the shores of West Maui.  Inspired by the Maui lifestyle, we aim to provide incredible vacation experiences at a curated collection of premier resort residences.

For your convenience, our warehouse and offices are located in Kaanapali North Beach, just minutes from all of the West Maui resorts.

Our Ritz-Carlton and Marriott trained staff are here to serve. Your guest experience is our highest priority. The privilege to host your precious Maui vacation is ours. 

As an added benefit, our exclusive Maui Resort Rentals courtesy shuttle offers free guest transportation between our West Maui resorts a number of West Maui locations - including Lahaina, Kapalua, and Whaler's Village.

www.airbnb.com/p/mauiresortrentals",488
3183,107293305,Gather,"Gather with us! Gather Vacation Rentals is the leading luxury property manager in the US. Gather was founded in 2005 and our properties reflect our high standards of excellence. With over 400 professionally managed luxury homes available for vacation rentals, we are committed to making sure that our vacation clients experience the very best in quality, delivery, and outstanding service Our Vacation Rental Management Team reflects our high standards of excellence. With over 400 professionally managed luxury homes available for vacation rentals throughout the US, we are committed to ensuring our vacation clients experience the very best in quality, delivery, and outstanding service. Active Member of: - (VRMA) Vacation Rental Managers Association - (NAR) National Association of Realtors",433
3448,132087088,Maui Condo,"At Maui Condo and Home, LLC we continue to serve our owners and guests with the same Aloha Spirit that we shared over 20 years ago. Though our business has changed through expansion and growth to include properties beyond Maui -- on the islands of Oahu, Hawaii and Kauai --  our values and sense of Aloha remain. We have implemented new business strategies and have remained at the top of the Property Management industry on Maui. We are excited to continue to serve our current owners and return guests, as well as welcome new owners and guests to Maui Condo and Home.
Click here to view all  of our listings: www.airbnb.com/p/mauicondo",401
3256,113441705,My Perfect Stays,"My Perfect Stays is here to make your Maui vacation unforgettable! We are committed to delivering our valued guests the very best in quality and service. A member of our team will be available throughout your trip and beyond to ensure your vacation is hassle free and relaxing from the moment you arrive. We offer complimentary concierge services with all our properties.

My Perfect Stays
(800) 295-3855
reservations@myperfectstays.com",332
4096,231330348,Coral Tree Residences,"Welcoming visitors to the Hawaiin islands for 30 years, Destination Residences Hawaii specializes in an exclusive selection of vacation residences that offers the comfort and convenience of a Maui vacation rental, paired with unparalleled hotel services and amenities.

Pro Marketing Page Link:
https://www.airbnb.com/users/231330348/listings",306
2103,37839136,Vacasa Hawaii,"Hi, we’re Vacasa, North America’s largest vacation rental management company. Owners of vacation homes around the world trust us to deliver exceptional service throughout your entire vacation. Professional housekeepers clean and stock each home, and our customer care team is available around the clock—with a local property manager ready to show up and help out. We like to think we offer the best of both worlds: you can enjoy a one-of-a-kind vacation experience in a unique property, without compromising on service and convenience. Check out our listings, and get in touch if you have any questions. Your vacation is our full-time job, and we'd love to help you plan your perfect getaway.",303
4714,442029804,Live Suite,"At Live Suite Resorts, we help timeshare owners rent their suites to cover their HOA fees.  We ask that you support our wonderful owners instead of the big hotel chains! Thank you!",284
3233,111808435,Vacasa,"Vacasa
Vacation Home Management

Vacasa unlocks the possibilities of how we enjoy vacation homes. We take care of managing our homeowners’ vacation houses so they can have peace of mind (and their home when they want to). And our guests book vacations confidently knowing they’re going to find exactly what they’re looking for without any surprises.

Each vacation home is always cared for by our professional local teams who implement our high cleanliness and maintenance values, while the hands-off tasks of vacation rental management--marketing, filing taxes, and maintaining a website--are handled by a specialized central support team. Our passion and focus remain true: to empower our homeowners, guests, and employees to invest in vacation.",274
3124,101401250,Parrish Kauai,"Jonathan Parrish, or ""JP"" as he is referred to by friends, family, and colleagues, is actively involved with the day to day activities of The Parrish Collection Kauai.  

My personal goal is to ensure that we are exceeding the expectations of all our guests! 

Explore our unique collections of extraordinary Kauai vacation rentals, then match your style with the largest variety of properties available including the Kauai’s most popular resorts and widest selection of oceanfront homes in Poipu Beach. 

",252
4753,451239593,Hawaii Vacation Condos By OUTRIGGER,"The Outrigger Way

Developed in 1993 with Hawaiian scholar and historian Dr. George Kanahele, the Ke 'Ano Wa'a process was designed to advance the company's corporate culture and fundamental business strategies. The values-based process intricately connected three core elements of the hospitality industry:

HOST + GUEST + PLACE

It also deepened Outrigger's understanding and appreciation of the local host culture, a distinct hospitality style that is recognized across the globe.",250
1380,15820446,Maui Paradise Properties,"Vacation Rental Management, Property Management, Asset Management, Real Estate Sales and Financial Analysis on  real estate.

We give our pledge to you to make your vacation on Maui as easy and pleasurable as possible. We understand that vacationing with your family and friends is a time for memories, rest, and vital rejuvenation.

We provide the support and peace of mind for your ultimate vacationing experience on Maui.
Link to all our listings:  https://airbnb.com/users/15820446/listings 

We are especially empathetic for our Vacationers.  We are not perfect but we do try hard.  We are all local to Maui and try to represent the Aloha Spirit.

We have discovered for ourselves the pleasure of vacationing in this paradise called: Maui.  All of us came here many years ago, drawn to the mystique and spectacular beauty of the Island. Our satisfaction grows each time we are able to provide that special place our vacationers have worked for and dreamed of for so long. This is truly a marvelous business, and we give thanks each day for this wonderful opportunity.",243
741,5615582,RoomPicks,"Our selected accommodations combine the best features of a hotel and vacation rental home to ensure a wonderful and effortless stay! We take the guesswork out of where you are staying so you can concentrate on what you want to be doing.

We handpick the accommodations in the best properties all over the US offering great vacation rental experience and impeccable service: serviced apartments, oversized suites and accommodations in resorts with outstanding amenities and much more! We do this by testing them ourselves before the hit the list, so we know what to expect before you make the reservation. 

We are available 24/7 to make sure all your special requests are taken care of and to assist with any questions or issues you might have throughout your stay!",234
3613,151398424,Evolve,"Hi! We’re Evolve, the hospitality team that helps you rest easy when you rent a private, professionally cleaned home from us.

We promise your rental will be clean, safe, and true to what you saw on Airbnb or we'll make it right. Check-ins are always smooth, and we're here 24/7 to answer any questions or help you find the perfect property.",232
1480,18476866,Kona Coast,"Kona Coast Vacations hosts over 5,400 reservations a year with the help of knowledgeable management, proficient team members and trusted home owners. Open 7 days a week, we strive to help with each visitors’ every need. Sharing Aloha from the first contact whether it is phone or email, we are here to assist by making the booking process as seamless as can be. We pride ourselves on providing hands on assistance whenever it is needed, whether it is reservation details, maintenance issues, or even booking activities! 

Kona Coast Vacations is fortunate to team up with great property owners which is instrumental in providing exceptional homes for our new and returning guests. With over 240 vacation rentals from oceanfront homes, ocean view condos and private estates, we are here for your every need, open seven days a week to take care of our guests and owners. With two locations in Kailua Kona and Mauna Lani we have dedicated specialists in guest services managing reservations, maintenance, and property checks alongside our accounting, support and marketing specialists. We are proud to be Airbnb members since 2001 and now are Superhosts with over 1070 reviews.
We hope to host you Hawaii and help create a memory to last you a lifetime. We are your “’Ohana” (family) on the Big Island of Hawaii, please do not hesitate to utilize our listed resources and book activities thru Kona Concierge.  
",232
2410,51017586,Rentals Maui,"Rentals Maui Inc. is a locally owned & managed Vacation Rental management company located in Kihei, Maui. We've been doing business on Maui for the past 20 years and we are fully licensed by the State of Hawaii, insured, and bonded.

We currently manage over 300 properties in South Maui, which is also where our office is located, making it convenient should guests need assistance day or night.",223
2232,43793840,Mark,Real Estate Broker,207
159,680107,Hawaii Life,"Hawaii Life Vacations is  a local real estate company offering vacation and long term rentals on all Hawaiian Islands.  We offer island hosts, property managers and offices statewide. Our rentals are professionally managed and each home comes with complimentary concierge services. We look forward to hosting you.",195
2611,61304968,Alii Resorts,"Ali'i is Hawaiian for ""royalty,"" and we strive to live up to our name by giving each of our guests the royal treatment. Amenities include:

Pre-check in condo inspection by our attentive staff
Personal ""Aloha"" upon your arrival
Full concierge and activity service
Gift pack of elite bath amenities
Luxury bed linens and towels

Why Us
With over 25 years of combined experience managing South Maui vacation condos in the Kihei, Wailea and Makena areas, we have earned our reputation as experts in Hawaii vacations. No one knows Maui like we do. It's the rare combination of quality and service that sets Ali'i Resorts apart. We work hard to elevate our brand to be the top vacation rental company on Maui. We maintain our 5 star Trip Advisor rating by keeping a full staff who strives to exceed your expectations for escape, and deliver your vacation accommodations with ease and satisfaction. We are your personal concierge and will work with you prior to your arrival to plan a range of services, activities, experiences, and excursions - be it a week of action and adventure or a complete relaxation. Come see us soon and let our ohana create a vacation of dreams for you and your family.

",192
4667,429407284,K B M Resort Rentals,"KBM Resorts caters to those who appreciate the size and comfort of a fully equipped property but don't want to sacrifice the convenience and amenities of a 5 star hotel. KBM Resorts blends these two worlds together by providing beautiful, full-size residences with hotel-style features and amenities you have come to expect from the finest hotel resorts. Each KBM Resort property features Fully-equipped kitchens, complimentary L'Occitane bath and body lotions, housekeeping and concierge teams, personal grocery delivery, personal greeters and more.

Each KBM Resorts location is fully-staffed with local Guest Ambassadors, Concierge Agents, Activities Desk, Maintenance and Housekeeping teams, Quality Control Inspectors, Laundry facilities and more. If your family ever needs assistance or service our staff is just steps away and ready to help. We employ only dedicated local professionals who believe in our community, deeply care for our Homeowners and Guests, and are genuinely excited to share local expertise to deliver your family a dream vacation.

All KBM Resort locations feature beautiful distinctive residences, professional cleaning and sanitization, fully-equipped kitchens, 24/7 Guest Support teams, complimentary high-speed WiFi, and a seamless checkin process. You and your family are always a call, click, or text away from our local Guest Ambassadors whose sole mission is to deliver your dream vacation.",186
2749,69552498,Captain Cook Resorts,"ALOHA! E komo mai and mahalo for choosing to stay with Captain Cook Resorts!

Captain Cook Resorts proudly manages over 170 privately-owned vacation rentals in Waikiki (a district of Honolulu on the island of Oahu). Everyone on the fun and energetic CCR team works hard to offer great accommodations, great service, and has a passion for sharing all that Oahu has to offer our guests!

We appreciate that you're on vacation, and we ask that you let us know if there's anything we can do to make this visit stand out as one of your best!

ALL CAPTAIN COOK RESORTS RENTALS INCLUDE:
– Bath towels, Beach towels, Bed linens
– Dishes, Silverware, Cookware (including tea kettle & rice cooker)
– Beach chairs, Hair dryer, Iron/Ironing board
– Start-Up Supplies: coffee filters, laundry detergent, dish soap, dishwasher soap, bar soap, paper towels, toilet paper, tissue, basic cleaning supplies, and travel size (2 oz.) shampoo, conditioner, body wash, body lotion
– NOT PROVIDED: beach umbrellas, beach toys, aluminum foil, Ziploc bags, coffee, condiments/seasonings, cooking oil, fabric softener, or bleach. This private vacation rental does NOT include resort services such as daily housekeeping, replenishment of towels or toiletry supplies, or hotel front desk services.

Please let us know if you have any questions!

Mahalo!",186
4604,411546857,Anna,"Hey y’all, Anna here. Mother of 2 rambunctious boys and a husband who embraces my adventurous traveling spirit. We have lived from coast to coast and venture in between. Let me help you find the perfect destination to create everlasting memories. ",183
1301,14143158,Bethany,"Superhost: Aloha! I love to help families and friends travel-to the Hawaiian Islands, California, Utah, Florida and more. You will enjoy beautiful resorts, access to all resort amenities & staff are at your service during your stay. I will also be available before and during your trip to help you make it the best experience possible. ***I can look up dates/locations/prices for you. Just ask! Always happy to help! Bethany 
Hawaiidiscounts808@gmale",179
2153,40240788,Vacasa Hawaii,"Vacasa unlocks the possibilities of how we enjoy vacation homes. We take care of managing our homeowners’ vacation houses so they can have peace of mind (and their home when they want to). And our guests book vacations confidently knowing they’re going to find exactly what they’re looking for without any surprises.

Each vacation home is always cared for by our professional local teams who implement our high cleanliness and maintenance values, while the hands-off tasks of vacation rental management--marketing, filing taxes, and maintaining a website--are handled by a specialized central support team. Our passion and focus remains true: to empower our homeowners, guests, and employees to invest in vacation.",167
2380,49441399,Knutson & Associates,"We have been serving visitors to the Big Island since 1976, With the finest Vacation Homes and Condos available!

Knutson & Associates is a mid-sized, independently owned company consisting of dedicated professional Realtors®.

Our offices are located in Kailua-Kona, on the Big Island of Hawaii. We are celebrating our 48th year in business here in Kailua-Kona in 2024",158
3011,92715155,Ali'I Beach,"Ali’i Beach Rentals is an established team specialist in Oahu Vacation Rentals and Monthly Rentals since 2004. Our Customer Service, quality assurance procedures, and Aloha Spirit are unsurpassed! We have knowledgeable on-island staff available, 7 days a week for your assistance. To view all of our listings visit: www.airbnb.com/p/aliibeachrentals",157
2812,74079684,Marina,"Since 1965, Marina Hawaii Vacations has offered the best places to stay on the island of Oahu. Marina Hawaii Vacations' more than 300 privately-owned condominiums are located in the Ilikai Hotel, the Ilikai Marina and Discovery Bay - within easy walking distance to the heart of Waikiki and Hawaii's popular Ala Moana Shopping Center. Repeat visitors from the U.S. mainland, Canada, Europe and Asia trust Marina Hawaii Vacations for convenience, great quality and prices. Many of our guests are annual visitors who have stayed with us for the past 30 years. Check out the other properties that we manage at www.marinahawaiivacations.com",153
4129,240078487,Steven,"I have access to many locations not listed here, so if you're looking - let me know where and I'm happy to check in to it for you.",148
3077,97006413,Suite Paradise,"Suite Paradise – The gateway to island living.

Suite Paradise in sunny Poipu Beach on Kauai is home to hundreds of vacation rental properties, amenable to any sized group and any specifications you could think of. With the highest level of service and a wide range of vacation rental options, Suite Paradise can ensure that your stay is as seamless as Kauai’s lifestyle.

Choose from luxurious beach resorts, each with multiple pools and spas within walking distance and top-of-the-line amenities, including, but not limited to, full membership to Poipu Beach Athletic Club for the duration of your stay. Poipu Kai consists of 70 acres of lush tropical foliage and some of Kauai’s most sought-after vacation rentals. One complex is literally located nestled in a verdant and extinct volcano crater – you can’t get more immersed in the island lifestyle than that! From mauka (mountain) to makai (sea), Suite Paradise has something for you!

Kahala – A popular complex that is home to mostly one- and two-bedroom units. Kahala is only a short walk from the beach, and closest to Poipu Kai’s tennis courts and Kalapaki Joe’s sports bar. With the option of both mountain and ocean views available dependent on the unit, Kahala’s location is perfectly situated with proximity to Poipu Road as well as the Poipu Kai greenbelt.

Makanui – Two- and three-bedroom units perched across from Poipu Crater, with stunning mountain views, distant ocean views, and a short walk to the greenbelt path.

Manualoha –Less than a mile from the beach, although the complex pool is practically attached to the Pacific Ocean! With units sleeping four to six, easy access to the greenbelt pathway, and hues of purple bougainvillea draped throughout the complex.

Poipu Sands – One- and two-bedroom units with incredible ocean views, spacious lanais, and a short walk to Shipwreck’s Beach.

Regency – Larger units, spacious enough to accommodate up to 10 guests. Many of these units are newly remodeled and offer AC. Regency and Kahala sit right next to each other.

Regency Villas – Luxury units with central AC. Regency Villas often feature a loft and sleep up to five guests. Situated near the greenbelt for easy access to many resort amenities, and centrally located for a short walk to Brennecke's Beach, or access to the Grand Hyatt Kauai Resort.

Nihi Kai Villas - A comfortable and quiet beach resort with 70 condos to choose from. Located right across from the ocean.

Poipu Crater – Just as the name says, Poipu Crater is nestled in a verdant an extinct volcano crater, which makes the foliage truly breathtaking. With 30 condos to choose from, sleeping four to six guests, the choice is yours! Enjoy the tropical gardens and central location to all that Poipu has to offer.

Lawai Beach Resort - Luxurious oceanfront condos located directly across from arguably the best snorkeling spot on the island. Enjoy a short stroll to five-star dining at The Beach House or enjoy the view from Lawai Beach, as the surfers paddle out for a sunset session. With room to sleep up to six, Lawai Beach Resort has it all!

Poipu Kapili - A beautiful and peaceful resort located on five acres of meticulously landscaped oceanfront property.

Pili Mai - This is Kauai’s newest resort development of luxury condominiums, nestled among a championship golf course.",128
4664,428576478,Ryan,Beach days. Mountain getaways. City-scapes. We've got thousands of vacation rentals to choose from in North America's most loved vacation spots. ,121
3064,96255708,Jeff And Suzanne,"Jeff & Suzanne have been hosting guests in their luxury vacation rentals on the Big Island of Hawaii for the past several years.   Their company Paradise in Hawaii Luxury Homes consists of a large team of passionate, dedicated individuals focused on helping guests have amazing holidays.    From the initial three homes to now over forty (40) homes all equipped to the same high standards they have never lost their attention to detail.     While they have added team members they remain directly involved with each and every guest.    They treat every guest like their trip to Hawaii is their life long dream fulfilled.   They love being part of helping families create amazing memories.  Come try the Paradise in Hawaii experience!",120
2364,48697898,South Kohala,"We are a brother and sister team, born and raised on the Big Island, managing over 100 luxury vacation rentals on the Kohala Coast. We are passionate about our work and sharing the beauty and wonder of Hawaii Island with our guests. Our offices are open 365 days/year so that you will always have a local professional to call upon. ",118
4482,371942068,Joy,"Hi, I'm Joy! I'm excited for you to check out my listings and discover all the places you can go! I would love to be a part of your travel journey, as its one of my favorite things in life! My parents had us on adventures starting at a very young age and I thankfully got to see and experience so many wonderful and breathtaking places! I love taking my family on those same adventures now and would be so excited to help you plan out some of yours! Please feel free to reach out with any questions you might have, I am representing owners of the underutilized timeshares that might be just perfect for your next journey! If there is anything you're looking for and don't see in the listings please let me know and a lot of times I can help track down exactly what you are looking for! Can't wait to start planning your next adventure with you! Happy Travels!",113
2183,41842769,Resortica,"Aloha!
We are ResorticaHawaii, a professional vacation rental management company on the Big Island.  We have had the pleasure of hosting thousands and thousands of guests since 2006. We have built beautiful relationships with our returning guests and love to share the ""aloha"" with all of our guests.
We look forward to building our relationship with Air BnB!",112
2199,42612930,Midway Vacations,"Welcome to Midway Vacations! We specialize in top-notch vacation rentals in Waikiki & Maui.

Expect:
• Round-the-clock support from our team
• Impeccable cleanliness by our housekeeping team
• Professionally laundered linens & towels
• Well-maintained properties
• Quick response from our maintenance team

Relax and create lasting memories with your Ohana in our homes. Meticulously cared for, fully stocked units await. Experience Aloha with us!",110
336,1770887,Chris,"Hi, 

My name is Chris Finke, owner of Resort Rentals International, and we have been renting out units at resorts since 2008. Please let me know if you have any questions and I will be very happy to help you.  

Best Regards, 

Chris Finke",107
4461,355450429,Mike,"Based in Brooklyn, New York, KOALA wants to transform the way people take vacations. Our goal is to make it easier for travelers to book beautiful resort stays at surprisingly low prices, while helping timeshare owners cover expenses for a space they can’t use. It’s a win-win!

Mike is the cofounder and CEO of KOALA. His mission is to make it secure and easy for travelers like you to access space and resort amenities at affordable prices.",103
4491,373307437,Deena,"AIRBNB Host & Property Manager for multiple locations, On Point-Travel! I’m available 24/7 @365 anytime you need me I will be there to help you in any way I can.  Fast response times! Whether it's beaches or ski resorts I have locations everywhere. Let me be your personal travel agent! Im a very responsive and promise to answer all of your questions! Would love to earn your business and help you get on vacation!",103
